<?xml version="1.0"?>
<!--
Click nbfs://nbhost/SystemFileSystem/Templates/Licenses/license-default.txt to change this license
Click nbfs://nbhost/SystemFileSystem/Templates/XML/XmlSchema.xsd to edit this template
-->

<xs:schema version="1.0"
           xmlns:xs="http://www.w3.org/2001/XMLSchema"
           elementFormDefault="qualified">
    
    <xs:element name="FruitStore">
        <xs:complexType>
            <xs:sequence>
                <xs:element name="Products">
                    <xs:complexType>
                        <xs:sequence>
                            <xs:element maxOccurs="unbounded" name="Product">
                                <xs:complexType>
                                    <xs:sequence>
                                        <xs:element name="name">
                                            <xs:complexType>
                                                <xs:simpleContent>
                                                    <xs:extension base="xs:string">
                                                        <xs:attribute name="color" type="xs:string" use="optional"/>
                                                    </xs:extension>
                                                </xs:simpleContent>
                                            </xs:complexType>
                                        </xs:element>
                                        <xs:element name="icon" type="xs:string" />
                                        <xs:element name="properties">
                                            <xs:complexType>
                                                <xs:simpleContent>
                                                    <xs:extension base="xs:string">
                                                        <xs:attribute name="vitamin" use="required">
                                                            <xs:simpleType>
                                                                <xs:restriction base="xs:string">
                                                                    <xs:pattern value="[A-Z]"/>
                                                                </xs:restriction>
                                                            </xs:simpleType>
                                                        </xs:attribute>
                                                    </xs:extension>
                                                </xs:simpleContent>
                                            </xs:complexType>
                                        </xs:element>
                                        <xs:element name="prices">
                                            <xs:complexType>
                                                <xs:sequence>
                                                    <xs:element maxOccurs="unbounded" name="price" type="xs:decimal" />
                                                </xs:sequence>
                                            </xs:complexType>
                                        </xs:element>
                                        <xs:element name="origin">
                                            <xs:complexType>
                                                <xs:sequence>
                                                    <xs:element name="country" type="xs:string" />
                                                </xs:sequence>
                                                <xs:attribute name="continent" use="required">
                                                    <xs:simpleType>
                                                        <xs:restriction base="xs:string">
                                                            <xs:enumeration value="LATAM"/>
                                                            <xs:enumeration value="Asia"/>
                                                            <xs:enumeration value="Europe"/>
                                                            <xs:enumeration value="North America"/>
                                                            <xs:enumeration value="Oceania"/>
                                                        </xs:restriction>
                                                    </xs:simpleType>
                                                </xs:attribute>
                                            </xs:complexType>
                                        </xs:element>
                                    </xs:sequence>
                                    <xs:attribute name="category" use="required">
                                        <xs:simpleType>
                                            <xs:restriction base="xs:string">
                                                <xs:enumeration value="fruit"/>
                                                <xs:enumeration value="vegetable"/>
                                                <xs:enumeration value="prepared"/>
                                            </xs:restriction>
                                        </xs:simpleType>
                                    </xs:attribute>
                                    <xs:attribute name="season" use="required" >
                                        <xs:simpleType>
                                            <xs:restriction base="xs:string">
                                                <xs:enumeration value="summer"/>
                                                <xs:enumeration value="autumn"/>
                                                <xs:enumeration value="winter"/>
                                                <xs:enumeration value="spring"/>
                                                <xs:enumeration value="all"/>
                                            </xs:restriction>
                                        </xs:simpleType>
                                    </xs:attribute>
                                </xs:complexType>
                            </xs:element>
                        </xs:sequence>
                    </xs:complexType>
                </xs:element>
            </xs:sequence>
        </xs:complexType>
    </xs:element>
</xs:schema>